{
  "$schema": "https://nordicsemiconductor.github.io/nrfprogrammer-firmware-images/application.schema.json",
  "app_id": "f42ff902-45ca-4558-b8bc-4d9b798ee433",
  "app_name": "nRF Machine Learning",
  "user_id": "00005900-0000-1000-8000-00805F9B34FB",
  "description": "The nRF Machine Learning application is an out of the box reference design of an embedded machine learning using Edge Impulse. The application gathers data from sensors, forwards data to the Edge Impulse platform, and runs the machine learning model. It also displays results of the machine learning model on LEDs. The Edge Impulse platform collects data from sensors, trains machine learning model, and deploys the model to your Nordic Semiconductorâ€™s device.",
  "tags": ["machine learning", "edge impulse"],
  "versions": [
    {
      "version": "1.0.0",
      "release_notes": "Initial release",
      "requires_bonding": true,
      "links": [
        {
          "text": "Documentation",
          "url": "https://developer.nordicsemi.com/nRF_Connect_SDK/doc/1.9.1/nrf/applications/machine_learning/README.html"
        }
      ],
      "board": [
        {
          "name": "thingy53_nrf5340",
          "build_config": [
            {
              "name": "release",
              "file": "machine_learning_1.0.0_thingy53_nrf5340_zrelease.zip"
            },
            {
              "name": "debug",
              "file": "machine_learning_1.0.0_thingy53_nrf5340_zdebug.zip"
            },
            {
              "name": "debug_rtt",
              "file": "machine_learning_1.0.0_thingy53_nrf5340_zdebug_rtt.zip"
            }
          ]
        }
      ]
    }
  ]
}
