{
  "$schema": "https://nordicsemiconductor.github.io/nrfprogrammer-firmware-images/application.schema.json",
  "app_id": "57133692-965b-4e53-b480-4dfbc27b6dbc",
  "app_name": "Bluetooth mesh: light fixture",
  "user_id": "00005900-0000-1000-8000-00805F9B34FB",
  "description": "The BluetoothÂ® mesh light fixture sample demonstrates how to set up a light control mesh server model application, and control a dimmable LED with Bluetooth mesh using the Generic OnOff models.",
  "tags": ["mesh", "light fixture", "ctrl", "smart home"],
  "versions": [
    {
      "version": "1.0.0",
      "release_notes": "Initial release, based on NCS 1.9.1.",
      "requires_bonding": false,
      "links": [
        {
          "text": "nRF Mesh for Android",
          "url": "https://play.google.com/store/apps/details?id=no.nordicsemi.android.nrfmeshprovisioner"
        },
        {
          "text": "nRF Mesh for iOS",
          "url": "https://apps.apple.com/us/app/nrf-mesh/id1380726771"
        },
        {
          "text": "Documentation",
          "url": "https://developer.nordicsemi.com/nRF_Connect_SDK/doc/1.9.1/nrf/samples/bluetooth/mesh/light_ctrl/README.html"
        }
      ],
      "board": [
        {
          "name": "thingy53_nrf5340",
          "build_config": [
            {
              "name": "release",
              "file": "mesh_light_ctrl_1.0.0_thingy53_nrf5340.zip"
            }
          ]
        }
      ]
    },
    {
      "version": "2.3.0",
      "release_notes": "- Enabled the CONFIG_SOC_FLASH_NRF_PARTIAL_ERASE Kconfig option.\n- The specification-defined illuminance regulator now selects the CONFIG_FPU option by default.\n- Added a configuration with support for storing data with Emergency data storage.\n- Changed the sample to restore Light state after power-down.\n- Max size of Proxy Filter list increased from 3 to 16.\n\nKnown issues:\n- Setting a publication may cause Thingy:53 to reboot.",
      "requires_bonding": false,
      "links": [
        {
          "text": "nRF Mesh for Android",
          "url": "https://play.google.com/store/apps/details?id=no.nordicsemi.android.nrfmeshprovisioner"
        },
        {
          "text": "nRF Mesh for iOS",
          "url": "https://apps.apple.com/us/app/nrf-mesh/id1380726771"
        },
        {
          "text": "Documentation",
          "url": "https://developer.nordicsemi.com/nRF_Connect_SDK/doc/2.3.0/nrf/samples/bluetooth/mesh/light_ctrl/README.html"
        },
        {
          "text": "Emergency data storage (EMDS)",
          "url": "https://developer.nordicsemi.com/nRF_Connect_SDK/doc/2.3.0/nrf/libraries/others/emds.html"
        }
      ],
      "board": [
        {
          "name": "thingy53_nrf5340",
          "build_config": [
            {
              "name": "release (settings)",
              "file": "mesh_light_ctrl_2.3.0_thingy53_nrf5340.zip"
            },
            {
              "name": "release (emds)",
              "file": "mesh_light_ctrl_2.3.0_thingy53_nrf5340_emds.zip"
            }
          ]
        }
      ]
    },
    {
      "version": "2.5.0",
      "release_notes": "- Publications fixed,\n- Link layer payload size over GATT increased from 27 to maximum 37 to avoid fragmentation of outgoing messages to the proxy client,\n- Support for Composition Data Pages 1 and 2 (Bluetooth mesh 1.1),\n- Added support for the Scene Server and Sensor Server models.",
      "requires_bonding": false,
      "links": [
        {
          "text": "nRF Mesh for Android",
          "url": "https://play.google.com/store/apps/details?id=no.nordicsemi.android.nrfmeshprovisioner"
        },
        {
          "text": "nRF Mesh for iOS",
          "url": "https://apps.apple.com/us/app/nrf-mesh/id1380726771"
        },
        {
          "text": "Documentation",
          "url": "https://developer.nordicsemi.com/nRF_Connect_SDK/doc/2.5.0/nrf/samples/bluetooth/mesh/light_ctrl/README.html"
        },
        {
          "text": "Emergency data storage (EMDS)",
          "url": "https://developer.nordicsemi.com/nRF_Connect_SDK/doc/2.5.0/nrf/libraries/others/emds.html"
        }
      ],
      "board": [
        {
          "name": "thingy53_nrf5340",
          "build_config": [
            {
              "name": "release (settings)",
              "file": "mesh_light_ctrl_2.5.0_thingy53_nrf5340.zip"
            }
          ]
        }
      ]
    }
  ]
}
