{
  "$schema": "https://nordicsemiconductor.github.io/nrfprogrammer-firmware-images/application.schema.json",
  "app_id": "7f296ed9-a9fc-424d-b2ca-e2c17fa3eab6",
  "app_name": "Edge Impulse - Wi-Fi",
  "user_id": "00005900-0000-1000-8000-00805F9B34FB",
  "description": "Embedded machine learning application using Edge Impulse with nRF7002 Expansion Board support. The application gathers data from sensors over Wi-Fi and forwards to the Edge Impulse platform. The Edge Impulse platform collects data from sensors, trains machine learning model, and deploys the model to the Thingy:53 using nRF Edge Impulse mobile app.",
  "tags": ["machine learning", "edge impulse"],
  "versions": [
    {
      "version": "2.4.0",
      "release_notes": "Initial release",
      "requires_bonding": false,
      "links": [
        {
          "text": "nRF Edge Impulse for Android",
          "url": "https://play.google.com/store/apps/details?id=no.nordicsemi.android.nrfei"
        },
        {
          "text": "nRF Edge Impulse for iOS",
          "url": "https://apps.apple.com/us/app/nrf-edge-impulse/id1557234087"
        },
        {
          "text": "Edge Impulse",
          "url": "https://edgeimpulse.com"
        },
        {
          "text": "Edge Impulse Studio",
          "url": "https://studio.edgeimpulse.com"
        },
        {
          "text": "Edge Impulse Documentation",
          "url": "https://docs.edgeimpulse.com"
        }
      ],
      "board": [
        {
          "name": "thingy53_nrf5340",
          "build_config": [
            {
              "name": "release",
              "file": "edge_impulse_wifi_2.4.0_thingy53_nrf5340.zip"
            }
          ]
        }
      ]
    }
  ]
}
