{
  "$schema": "https://nordicsemiconductor.github.io/nrfprogrammer-firmware-images/application.schema.json",
  "app_id": "54d9d2a9-fc5c-4311-8acc-8b3f21ece318",
  "app_name": "Bluetooth mesh: light switch",
  "user_id": "00005900-0000-1000-8000-00805F9B34FB",
  "description": "The Bluetooth® mesh light switch sample can be used to change the state of light sources on other devices within the same mesh network. It also demonstrates how to use Bluetooth® mesh models by using the Generic OnOff Client model in an application.",
  "tags": ["mesh", "light switch", "button", "smart home"],
  "versions": [
    {
      "version": "1.0.0",
      "release_notes": "Initial release",
      "requires_bonding": false,
      "links": [
        {
          "text": "nRF Mesh for Android",
          "url": "https://play.google.com/store/apps/details?id=no.nordicsemi.android.nrfmeshprovisioner"
        },
        {
          "text": "nRF Mesh for iOS",
          "url": "https://apps.apple.com/us/app/nrf-mesh/id1380726771"
        },
        {
          "text": "Documentation",
          "url": "https://developer.nordicsemi.com/nRF_Connect_SDK/doc/1.9.1/nrf/samples/bluetooth/mesh/light_switch/README.html"
        }
      ],
      "board": [
        {
          "name": "thingy53_nrf5340",
          "build_config": [
            {
              "name": "release",
              "file": "mesh_light_switch_1.0.0_thingy53_nrf5340.zip"
            }
          ]
        }
      ]
    },
    {
      "version": "2.3.0",
      "release_notes": "- Enabled the CONFIG_SOC_FLASH_NRF_PARTIAL_ERASE Kconfig option.\n- Added support for running the light switch as a Low Power node.\n- Updated all samples to use the Partition Manager, replacing the use of the Device Tree Source flash partitions.\n- Max size of Proxy Filter list increased from 3 to 16.",
      "requires_bonding": false,
      "links": [
        {
          "text": "nRF Mesh for Android",
          "url": "https://play.google.com/store/apps/details?id=no.nordicsemi.android.nrfmeshprovisioner"
        },
        {
          "text": "nRF Mesh for iOS",
          "url": "https://apps.apple.com/us/app/nrf-mesh/id1380726771"
        },
        {
          "text": "Documentation",
          "url": "https://developer.nordicsemi.com/nRF_Connect_SDK/doc/2.3.0/nrf/samples/bluetooth/mesh/light_switch/README.html"
        }
      ],
      "board": [
        {
          "name": "thingy53_nrf5340",
          "build_config": [
            {
              "name": "release",
              "file": "mesh_light_switch_2.3.0_thingy53_nrf5340.zip"
            }
          ]
        }
      ]
    },
    {
      "version": "2.5.0",
      "release_notes": "- Link layer payload size over GATT increased from 27 to maximum 37 to avoid fragmentation of outgoing messages to the proxy client.",
      "requires_bonding": false,
      "links": [
        {
          "text": "nRF Mesh for Android",
          "url": "https://play.google.com/store/apps/details?id=no.nordicsemi.android.nrfmeshprovisioner"
        },
        {
          "text": "nRF Mesh for iOS",
          "url": "https://apps.apple.com/us/app/nrf-mesh/id1380726771"
        },
        {
          "text": "Documentation",
          "url": "https://developer.nordicsemi.com/nRF_Connect_SDK/doc/2.5.0/nrf/samples/bluetooth/mesh/light_switch/README.html"
        }
      ],
      "board": [
        {
          "name": "thingy53_nrf5340",
          "build_config": [
            {
              "name": "release",
              "file": "mesh_light_switch_2.5.0_thingy53_nrf5340.zip"
            }
          ]
        }
      ]
    }
  ]
}
