{
  "$schema": "https://nordicsemiconductor.github.io/nrfprogrammer-firmware-images/application.schema.json",
  "app_id": "abd74ae0-0f96-49db-904d-500ef3d02bf7",
  "app_name": "Bluetooth mesh: light dimmer and scene selector",
  "user_id": "00005900-0000-1000-8000-00805F9B34FB",
  "description": "The BluetoothÂ® mesh light dimmer and scene selector sample demonstrates how to set up a light dimmer and scene selector application, and control dimmable LEDs with Bluetooth mesh using the Generic Level models, the Generic OnOff models, and the Scene models.",
  "tags": ["mesh", "light", "dimmer", "scenes", "smart home"],
  "versions": [
    {
      "version": "1.0.0",
      "release_notes": "Initial release from NCS 2.5.0.",
      "requires_bonding": false,
      "links": [
        {
          "text": "nRF Mesh for Android",
          "url": "https://play.google.com/store/apps/details?id=no.nordicsemi.android.nrfmeshprovisioner"
        },
        {
          "text": "nRF Mesh for iOS",
          "url": "https://apps.apple.com/us/app/nrf-mesh/id1380726771"
        },
        {
          "text": "Documentation",
          "url": "https://developer.nordicsemi.com/nRF_Connect_SDK/doc/latest/nrf/samples/bluetooth/mesh/light_dimmer/README.html"
        }
      ],
      "board": [
        {
          "name": "thingy53_nrf5340",
          "build_config": [
            {
              "name": "release",
              "file": "mesh_light_dimmer_2.5.0_thingy53_nrf5340.zip"
            }
          ]
        }
      ]
    }
  ]
}
