{
  "$schema": "https://nordicsemiconductor.github.io/nrfprogrammer-firmware-images/application.schema.json",
  "app_id": "0e68201e-845d-424b-b3c9-1665b4788ef1",
  "app_name": "Peripheral LBS",
  "user_id": "00005900-0000-1000-8000-00805F9B34FB",
  "description": "The Peripheral LBS sample demonstrates how to use the LED Button Service (LBS).",
  "tags": ["lbs", "led", "button"],
  "versions": [
    {
      "version": "2.0.0",
      "release_notes": "Initial release",
      "requires_bonding": false,
      "links": [
        {
          "text": "nRF Blinky for Android",
          "url": "https://play.google.com/store/apps/details?id=no.nordicsemi.android.nrfblinky"
        },
        {
          "text": "nRF Blinky for iOS",
          "url": "https://apps.apple.com/us/app/nrf-blinky/id1325014347"
        },
        {
          "text": "Documentation",
          "url": "https://developer.nordicsemi.com/nRF_Connect_SDK/doc/2.0.0/nrf/samples/bluetooth/peripheral_lbs/README.html"
        }
      ],
      "board": [
        {
          "name": "thingy53_nrf5340",
          "build_config": [
            {
              "name": "release",
              "file": "peripheral_lbs_2.0.0_thingy53_nrf5340.zip"
            }
          ]
        }
      ]
    },
    {
      "version": "2.3.0",
      "release_notes": "Version from NCS 2.3.0.",
      "requires_bonding": false,
      "links": [
        {
          "text": "nRF Blinky for Android",
          "url": "https://play.google.com/store/apps/details?id=no.nordicsemi.android.nrfblinky"
        },
        {
          "text": "nRF Blinky for iOS",
          "url": "https://apps.apple.com/us/app/nrf-blinky/id1325014347"
        },
        {
          "text": "Documentation",
          "url": "https://developer.nordicsemi.com/nRF_Connect_SDK/doc/2.3.0/nrf/samples/bluetooth/peripheral_lbs/README.html"
        }
      ],
      "board": [
        {
          "name": "thingy53_nrf5340",
          "build_config": [
            {
              "name": "release",
              "file": "peripheral_lbs_2.3.0_thingy53_nrf5340.zip"
            }
          ]
        }
      ]
    },
    {
      "version": "2.5.0",
      "release_notes": "Version from NCS 2.5.0.",
      "requires_bonding": false,
      "links": [
        {
          "text": "nRF Blinky for Android",
          "url": "https://play.google.com/store/apps/details?id=no.nordicsemi.android.nrfblinky"
        },
        {
          "text": "nRF Blinky for iOS",
          "url": "https://apps.apple.com/us/app/nrf-blinky/id1325014347"
        },
        {
          "text": "Documentation",
          "url": "https://developer.nordicsemi.com/nRF_Connect_SDK/doc/2.5.0/nrf/samples/bluetooth/peripheral_lbs/README.html"
        }
      ],
      "board": [
        {
          "name": "thingy53_nrf5340",
          "build_config": [
            {
              "name": "release",
              "file": "peripheral_lbs_2.5.0_thingy53_nrf5340.zip"
            }
          ]
        }
      ]
    }
  ]
}
