{
  "$schema": "https://nordicsemiconductor.github.io/nrfprogrammer-firmware-images/application.schema.json",
  "app_id": "d432882b-87cc-48bd-b858-c49c920d21f1",
  "app_name": "Bluetooth mesh: light",
  "user_id": "00005900-0000-1000-8000-00805F9B34FB",
  "description": "The BluetoothÂ® mesh light sample demonstrates how to set up a mesh server model application, and control LEDs with Bluetooth mesh using the Generic OnOff models.",
  "tags": ["mesh", "light", "led", "smart home"],
  "versions": [
    {
      "version": "2.0.0",
      "release_notes": "Initial release",
      "requires_bonding": false,
      "links": [
        {
          "text": "nRF Mesh for Android",
          "url": "https://play.google.com/store/apps/details?id=no.nordicsemi.android.nrfmeshprovisioner"
        },
        {
          "text": "nRF Mesh for iOS",
          "url": "https://apps.apple.com/us/app/nrf-mesh/id1380726771"
        },
        {
          "text": "Documentation",
          "url": "https://developer.nordicsemi.com/nRF_Connect_SDK/doc/2.0.0/nrf/samples/bluetooth/mesh/light/README.html"
        }
      ],
      "board": [
        {
          "name": "thingy53_nrf5340",
          "build_config": [
            {
              "name": "release",
              "file": "mesh_light_2.0.0_thingy53_nrf5340.zip"
            }
          ]
        }
      ]
    }
  ]
}
